### ISSUE TITLE
fix(rfc2544): throughput run reports success in ~1 ms having transmitted nothing

### ISSUE THREAD

**Issue by krisarmstrong** [MustardSeedNetworks/stem#1217]
## What happens

On a `CGO_ENABLED=1` Linux build whose `/api/v1/capabilities` reports
`{"reflector":{"supported":true},"testMaster":{"supported":true}}`, an
RFC 2544 throughput run **completes in about one millisecond, transmits
nothing, and is reported `"success": true`**. The requested duration is
ignored entirely.

Observed on linux/arm64 in an Apple `container` VM (Debian trixie,
`v0.24.109-2-g8d26fc7`, built from `8d26fc7` with gcc-14, linked against
`libxdp.so.1` / `libbpf.so.1`). I cannot say from here whether it is
arm64-specific — the CGO dataplane has only ever been *released* for linux
amd64, so this is the first time the arm64 CGO build has been exercised.

## Evidence

Command (peer is a second container running `stem reflect -i eth0 --profile all`):

```
stem test -i eth0 -t rfc2544_throughput --peer 192.168.64.39 -d 5 \
      --frame-sizes 64 --trials 1
```

Daemon log for the whole run — start, result and cleanup share one millisecond
stamp, for a run asked to last five seconds:

```
20:32:15.095Z INFO Starting run plan suiteId=stem-d0bfbca65ff34a5d-3 steps=1 interface=eth0
[215.124] [WARN] Could not detect interface speed for eth0, assuming 10 Gbps
[215.124] [INFO] RFC2544 Test Master v1.0.0 initialized
[215.124] [INFO] Interface: eth0, Line rate: 10.00 Gbps
[215.124] [INFO] Throughput test: frame_size=64
[215.124] [INFO] Throughput result: 0.00% (0.00 Mbps, 14880952 pps)
[215.124] [INFO] Cleanup complete
20:32:15.096Z INFO Run plan completed suiteId=stem-d0bfbca65ff34a5d-3 steps=1
```

`/api/v1/test/result` for that run:

```json
{ "status": "completed", "testType": "rfc2544_throughput", "module": "benchmark",
  "success": true,
  "data": { "FrameSize": 64, "Iterations": 0,
            "Latency": {"AvgNs":0,"Count":0,"JitterNs":0,"MaxNs":0,"MinNs":0,
                        "P50Ns":0,"P95Ns":0,"P99Ns":0},
            "MaxRateMbps": 0, "MaxRatePPS": 0, "MaxRatePct": 0 } }
```

Nothing was sent. `tcpdump -i eth0 -nn "udp or icmp"` on the **sender** captured
zero frames for the duration of a run, and `tcpdump -i eth0 -nn "udp port 3842"`
on the **reflector** likewise captured zero; the reflector's own
`/api/v1/stats` stayed at `packetsReceived: 0`.

The path itself is fine, which is what makes this a product defect rather than
an environment limitation: hand-sent UDP 3842 frames from the same sender
container arrive on the reflector's wire and are captured through AF_PACKET in
the same run window —

```
20:33:05.837139 IP 192.168.64.40.35137 > 192.168.64.39.3842: UDP, length 16
20:33:06.046473 IP 192.168.64.40.59962 > 192.168.64.39.3842: UDP, length 16
...
5 packets captured, 6 packets received by filter, 0 packets dropped by kernel
```

## Two things worth separating

1. **Zero frames sent.** `run_throughput_test` in `src/dataplane/common/core.c`
   guards its binary search with
   `while ((high - low) > resolution_pct && iterations < max_iterations && !cancel)`.
   `iterations: 0` in the result means that loop body never executed, so
   `run_trial` was never called. A degenerate `initial_rate_pct` or
   `max_iterations` would produce exactly this, instantly. Not diagnosed
   further here.

2. **Zero results reported as success.** Whatever causes (1), a run with
   `Iterations: 0`, `MaxRatePPS: 0` and a latency sample count of `0` must not
   come back `"success": true`. #1127's "reject zero-result success" does not
   cover this path. This half is platform-independent.

The C log line is also internally inconsistent and should be read with care:
it prints `0.00%` and `0.00 Mbps` beside `14880952 pps`, which is the full
theoretical 64-byte rate for 10 Gbps, while the API result carries
`MaxRatePPS: 0`.

## Why it was being exercised

Clearing the blocker recorded on ST-2 clause 3 / STM-13: whether a
`CGO_ENABLED=1` linux/arm64 build in two Apple containers can stand in for the
lab during lab week. The build, the dataplane link, the reflector start and
AF_PACKET between two containers all work; this is what stops the substitution.
Full record in `docs/audits/STM-13_CONTAINERS_2026-09-14.md`.

**Comment by krisarmstrong** [comment]
## Diagnosed — it is Go-side, and it is not arm64-specific

`(*Executor).configureContext` (`internal/services/servicetest/executor.go:205`)
builds the dataplane config as explicit zeros and then copies across **only**
`cfg.Duration` into `TrialDuration`:

```go
dpCfg := &dataplane.Config{
	Interface:      cfg.Interface,
	Peer:           cfg.Peer,
	PeerPort:       cfg.PeerPort,
	LineRate:       0,
	...
	FrameSize:      0,
	TrialDuration:  0,
	WarmupPeriod:   0,
	InitialRatePct: 0,
	ResolutionPct:  0,
	MaxIterations:  0,
	AcceptableLoss: 0,
	...
}

if cfg.Duration > 0 {
	dpCfg.TrialDuration = time.Duration(cfg.Duration) * time.Second
}
```

`run_throughput_test` (`src/dataplane/common/core.c:1259-1300`) seeds
`high = ctx->config.initial_rate_pct` and loops
`while ((high - low) > resolution_pct && iterations < max_iterations && ...)`.
With `initial_rate_pct == 0` and `max_iterations == 0` the condition is false on
entry, so `run_trial` is never called — hence zero frames, `Iterations: 0`, and
an instantaneous return. That accounts for every symptom in the report.

So the scope is wider than the title suggests: **every RFC 2544 parameter the
CLI and the UI collect — frame sizes, trials, resolution, max-loss, initial
rate, warmup — is dropped at this boundary**, not just the duration. And since
the defect is in Go, the earlier question in this issue is answered: it is
**not** arm64-specific, and the dev servers will behave the same way when the
lab is reachable again.

Worth flagging for whoever picks this up: I can find no record of a Pro
test-master run producing non-zero results on any host since the daemon-owned
CLI landed. ST-2's clause-3 attempt on `ens18` was refused `402 TIER_TOO_LOW`
before it ever reached the dataplane, and #1127's own history was a zero-result
run. Whatever `#1148` added to "reject zero-result success" evidently does not
key on `Iterations`/`MaxRatePPS`, because this run returned `"success": true`
with both at zero.

One correction to the original report, in the interest of not sending anyone
down a false trail: the reflector's `packetsReceived: 0` for my hand-sent UDP
3842 probes is **correct behaviour, not a second defect**. `--profile all` maps
to `SIG_FILTER_ALL`, which `packet_matches_signature`
(`src/reflector/packet.c:199-234`) treats as *all signature families* — ITO
PROBEOT/DATAOT/LATENCY at offset 5, RFC 2544 / Y.1564 / MSN at offset 0 — not
as "any UDP on the port". Unsigned text was rightly ignored.

**Comment by krisarmstrong** [comment]
**Proven fixed on the wire.** PR #1221 landed the Go fix but said `Related to`, not `Fixes`, because nothing had been proven on a wire. It has now been, on two Apple containers sharing one L2 segment with a `CGO_ENABLED=1` linux/arm64 build of `77645a4`. Full record: `docs/audits/STM-13_WIRE_2026-09-14.md` (PR #1234).

Half (a) — the search runs and the frames are real:

```text
"data": { "FrameSize": 64, "Iterations": 10,
          "MaxRateMbps": 9990.234375, "MaxRatePPS": 14866419, "MaxRatePct": 99.90234375 }
start 02:45:42   end 02:46:56          (~74 s for ten trials of -d 5; was ~1 ms)

reflector 192.168.64.52 : 8112 captured, 0 dropped by kernel (8095 signature frames)
sender    192.168.64.53 : 16207 captured, 0 dropped by kernel
02:45:43.276359 IP 192.168.64.53.12345 > 192.168.64.52.3842: UDP, length 18
02:45:43.328826 IP 192.168.64.52.3842 > 192.168.64.53.12345: UDP, length 18
```

The second capture line is the reflector returning the test master's own frames — the first observed reflection of RFC 2544 traffic anywhere.

Half (b) — the `Iterations == 0` guard, which was compile-verified only, fires for the first time. A build of the same tree with the pre-#1221 zeros restored in `buildDataplaneConfig`:

```text
real 0m0.102s
  "status": "error"
        "error": "throughput test ran no iterations: no frames were transmitted"
```

Same command, same bench: `"success": true` before the guard, a named failure after it.

**Two caveats, both filed.** The proof needed one scratch line forcing AF_PACKET, because the test master is AF_XDP-or-nothing (**#1232**) — that is the wall immediately behind this one, and it applies to CT307's LXC guest too. And the run that now passes reports 9990 Mbps over a link that carried ~110 pps (**#1233**): this issue's second half is fixed, but the shape it belongs to is not.
